name,mana_cost,cmc,type_line,oracle_text,loyalty,power,toughness,colours__001,colorus__002,colours__003,egalities__standard,legalities__pauper,set,collector_number,rarity,flavour_text,artist
"Vaevictis Asmadi, the Dire","{3},{B},{R},{G}",6,Legendary Creature ? Elder Dragon,"Flying\nWhenever Vaevictis Asmadi, the Dire attacks, for each player, choose target permanent that player controls. Those players sacrifice those permanents. Each player who sacrificed a permanent this way reveals the top card of their library, then puts it onto the battlefield if it's a permanent card.",,6,6,B,G,R,legal,not_legal,m19,225,mythic,,Steven Belledin
Valiant Knight,"{3},{W}",4,Creature ? Human Knight,"Other Knights you control get +1/+1.\n{3},{W},{W}: Knights you control gain double strike until end of turn.",,3,4,W,,,legal,not_legal,m19,42,rare,"""Defeat is no reason for retreat. It is a sign we must redouble our efforts to win this fight.""",Jakub Kasper
Vampire Neonate,{B},1,Creature ? Vampire,"{2}, {T}: Each opponent loses 1 life and you gain 1 life.",,0,3,B,,,legal,legal,m19,124,common,"One day, they may be paragons of deadly elegance. For the moment, they possess nothing but thirst.",Daarken
Vampire Sovereign,"{3},{B},{B}",5,Creature ? Vampire,"Flying\nWhen Vampire Sovereign enters the battlefield, target opponent loses 3 life and you gain 3 life.",,3,4,B,,,legal,not_legal,m19,125,uncommon,"""Your service shall be rewarded.""\n?Queen Lian",Volkan Ba?a
Viashino Pyromancer,"{1},{R}",2,Creature ? Viashino Wizard,"When Viashino Pyromancer enters the battlefield, it deals 2 damage to target player or planeswalker.",,2,1,R,,,legal,legal,m19,166,common,"""I trained with the Ghitu, and I respect the fire as they do.""",Jesper Ejsing
Vigilant Baloth,"{3},{G},{G}",5,Creature ? Beast,Vigilance (Attacking doesn't cause this creature to tap.),,5,5,G,,,legal,not_legal,m19,206,uncommon,Villagers employ watchdogs as guardians and companions. Druids prefer something a little bigger.,Uriah Voth
Vine Mare,"{2},{G},{G}",4,Creature ? Elemental Horse,Hexproof (This creature can't be the target of spells or abilities your opponents control.)\nVine Mare can't be blocked by black creatures.,,5,3,G,,,legal,not_legal,m19,207,uncommon,"When it passes, the dead are displaced by flourishing life.",Alex Konstad
Vivien of the Arkbow,"{4},{G},{G}",6,Legendary Planeswalker ? Vivien,+2: Put two +1/+1 counters on up to one target creature.\n?3: Target creature you control deals damage equal to its power to target creature you don't control.\n?9: Creatures you control get +4/+4 and gain trample until end of turn.,5,,,G,,,legal,not_legal,m19,301,mythic,,Magali Villeneuve
Vivien Reid,"{3},{G},{G}",5,Legendary Planeswalker ? Vivien,"+1: Look at the top four cards of your library. You may reveal a creature or land card from among them and put it into your hand. Put the rest on the bottom of your library in a random order.\n?3: Destroy target artifact, enchantment, or creature with flying.\n?8: You get an emblem with ""Creatures you control get +2/+2 and have vigilance, trample, and indestructible.""",5,,,G,,,legal,not_legal,m19,208,mythic,,Anna Steinbauer
Vivien's Invocation,"{5},{G},{G}",7,Sorcery,"Look at the top seven cards of your library. You may put a creature card from among them onto the battlefield. Put the rest on the bottom of your library in a random order. When a creature is put onto the battlefield this way, it deals damage equal to its power to target creature an opponent controls.",,,,G,,,legal,not_legal,m19,209,rare,,Johannes Voss
Vivien's Jaguar,"{2},{G}",3,Creature ? Cat Spirit,"Reach (This creature can block creatures with flying.)\n{2},{G}: Return Vivien's Jaguar from your graveyard to your hand. Activate this ability only if you control a Vivien planeswalker.",,3,2,G,,,legal,not_legal,m19,305,uncommon,Each of Vivien's arrows is an invocation of a species.,Magali Villeneuve
Volcanic Dragon,"{4},{R},{R}",6,Creature ? Dragon,Flying\nHaste (This creature can attack and {T} as soon as it comes under your control.),,4,4,R,,,legal,not_legal,m19,167,uncommon,Sometimes an eruption in Shiv produces something more dangerous than a mere river of molten rock.,Chris Rahn
Volley Veteran,"{3},{R}",4,Creature ? Goblin Warrior,"When Volley Veteran enters the battlefield, it deals damage to target creature an opponent controls equal to the number of Goblins you control.",,4,2,R,,,legal,not_legal,m19,168,uncommon,"""Fill the sky with stuff!""",Craig J Spearing
Walking Corpse,"{1},{B}",2,Creature ? Zombie,,,2,2,B,,,legal,legal,m19,126,common,"""Feeding a normal army is a problem of logistics. With zombies, it is an asset. Feeding is why they fight. Feeding is why they are feared.""\n?Jadar, ghoulcaller of Nephalia",Igor Kieryluk
Wall of Mist,"{1},{U}",2,Creature ? Wall,Defender,,0,5,U,,,legal,legal,m19,83,common,The seafloor is flecked with the bones of fools who dared sail into the mist.,Dimitar Marinski
Wall of Vines,{G},1,Creature ? Plant Wall,Defender (This creature can't attack.)\nReach (This creature can block creatures with flying.),,0,3,G,,,legal,legal,m19,210,common,"Like all jungle plants, the vines must fight and claw for sunlight. Once their place is secured, they grow strong, sharp, and impenetrable.",John Stanko
Waterknot,"{1},{U},{U}",3,Enchantment ? Aura,"Enchant creature\nWhen Waterknot enters the battlefield, tap enchanted creature.\nEnchanted creature doesn't untap during its controller's untap step.",,,,U,,,legal,legal,m19,311,common,,Wayne Reynolds
Windreader Sphinx,"{5},{U},{U}",7,Creature ? Sphinx,"Flying\nWhenever a creature with flying attacks, you may draw a card.",,3,7,U,,,legal,not_legal,m19,84,rare,"""Your mind is too filled with foolish concerns to hear the subtle whispers that the breeze brings.""",Min Yum
Woodland Stream,,0,Land,Woodland Stream enters the battlefield tapped.\n{T}: Add {G} or {U}.,,,,,,,legal,legal,m19,260,common,Waterways carve their routes through the land to reflect the paths the aether streams cut through the clouds.,Efflam Mercier
